Context,Questions,Answers,Patterns,Articles
"Autism Spectrum Disorder (ASD) is a developmental disorder that affects communication, social interaction, and behavior. It encompasses a wide range of symptoms and severity levels, often characterized by challenges in communication, repetitive behaviors, and sensory sensitivities.",What is autism spectrum disorder (ASD)?,"Autism spectrum disorder (ASD) is a developmental disorder that affects communication, behavior, and social interaction. It includes a wide range of conditions characterized by challenges with social skills, repetitive behaviors, speech, and nonverbal communication.",What is ASD?,https://www.autismspeaks.org/what-autism
"Early signs of autism in infants may include lack of or delayed response to name, reduced eye contact, minimal social smiling, limited gestures (like pointing), and delayed speech or lack of babbling by 12 months. These signs may indicate potential developmental delays and prompt further evaluation by healthcare providers.",What are the early signs of autism in infants?,"Early signs may include reduced eye contact, lack of response to name, delayed speech or language development, limited or no social smiling, and lack of gestures such as pointing or waving.",What early signs show autism in babies?,https://www.cdc.gov/ncbddd/autism/signs.html
"Autism is typically diagnosed through a comprehensive evaluation by healthcare professionals, including developmental pediatricians, psychologists, or neurologists. Diagnosis involves observing behavior and developmental history, often using standardized tools like the ADOS-2 or DSM-5 criteria to assess social communication, behavior, and sensory issues.",How is autism diagnosed?,"Autism is diagnosed through a combination of behavioral assessments, developmental screenings, parental interviews, and observations of the child's behavior and communication skills. There is no single medical test for autism diagnosis.",How do doctors diagnose autism?,https://www.autism-society.org/what-is/diagnosis/
"The exact causes of autism are not fully understood but likely involve a combination of genetic and environmental factors. Genetic mutations, prenatal factors (like maternal infections or medications), and advanced parental age are considered potential contributors.",What are the causes of autism?,"The exact causes of autism are not fully understood, but research suggests a combination of genetic and environmental factors. Genetic predisposition, prenatal factors (such as advanced parental age or maternal illness), and certain genetic mutations may contribute to autism.",What causes autism?,https://www.autismspeaks.org/what-causes-autism
"Currently, there is no cure for autism. However, early intervention and therapies can help improve symptoms and quality of life for individuals with autism. The focus is on support, education, and enhancing skills to maximize independence and social functioning.",Is there a cure for autism?,"Currently, there is no cure for autism. However, early intervention and appropriate therapies can help improve skills and quality of life for individuals with autism.",Can autism be cured?,https://www.autismspeaks.org/is-there-a-cure-for-autism
"Common symptoms of autism include difficulties in social interaction (such as understanding social cues), challenges in communication (verbal and non-verbal), repetitive behaviors (like hand-flapping), sensory sensitivities (to light, sound, touch), and sometimes, intellectual challenges or specific interests.",What are some common symptoms of autism?,"Common symptoms include challenges in social communication and interaction, restricted interests, repetitive behaviors, sensory sensitivities, and sometimes intellectual disabilities or delays in language development.",What are typical autism symptoms?,https://www.mayoclinic.org/diseases-conditions/autism-spectrum-disorder/symptoms-causes/syc-20352928
"Autism often affects communication skills by impairing verbal and non-verbal expression, understanding of gestures and facial expressions, and conversational turn-taking. Some individuals may have delayed speech or use repetitive language patterns (echolalia), while others may struggle with the pragmatics of language (knowing how to use language in different social situations).",How does autism affect communication skills?,"Autism can affect communication skills by impairing the ability to understand and use language effectively. Some individuals may have delayed speech development, difficulty with conversation, or rely on alternative communication methods like gestures or picture communication systems.",How does autism impact talking skills?,https://www.autismspeaks.org/communication
"Autism impacts social interactions by making it challenging to understand social norms, emotions, and non-verbal cues (like facial expressions or body language). Individuals with autism may have difficulty forming friendships, initiating or sustaining conversations, and interpreting others' intentions or perspectives.",How does autism affect social interactions?,"Autism impacts social interactions by making it challenging to understand social cues, establish and maintain relationships, and engage in typical social behaviors such as taking turns or showing empathy. Social difficulties can vary widely among individuals with autism.",How does autism impact social skills?,https://www.autism-society.org/what-is/social-interaction/
"Sensory sensitivities in autism refer to heightened or reduced sensitivity to sensory stimuli (like touch, sound, taste, smell, or sight). These sensitivities can lead to discomfort, anxiety, or withdrawal in response to certain sensory inputs that may be overwhelming or distracting.",What are sensory sensitivities in autism?,"Sensory sensitivities refer to heightened or reduced sensitivity to sensory stimuli such as light, sound, touch, taste, or smell. Individuals with autism may experience sensory overload or seek sensory stimulation to regulate their sensory experiences.",What are autism sensory issues?,https://www.ncbi.nlm.nih.gov/pmc/articles/PMC4276443/
"Repetitive behaviors in autism include stereotyped movements (like rocking or hand-flapping), insistence on sameness (routine adherence), repetitive speech or echolalia, and intense preoccupations with specific topics or objects. These behaviors can serve as self-regulation mechanisms or ways to cope with sensory input.",What are repetitive behaviors in autism?,"Repetitive behaviors in autism can include repetitive movements (stimming), insistence on sameness or routines, fixated interests, and unusual sensory behaviors. These behaviors may serve to self-regulate, reduce anxiety, or provide sensory stimulation.",What repetitive actions occur in autism?,https://www.autismspeaks.org/repetitive-behaviors
"Stimming (self-stimulatory behavior) refers to repetitive movements or sounds individuals with autism engage in to soothe themselves or manage sensory overload. Examples include hand-flapping, spinning objects, or repeating phrases. Stimming helps regulate sensory input and can provide comfort in stressful situations.",What is stimming and why do individuals with autism do it?,"Stimming (self-stimulatory behavior) includes repetitive movements or actions such as hand-flapping, rocking, or spinning objects. Individuals with autism may stim to regulate sensory input, manage stress or anxiety, or as a way of expressing excitement or frustration.",What is stimming in autism?,https://www.autismspeaks.org/stimming
"Sensory issues can significantly impact individuals with autism by causing discomfort, anxiety, or withdrawal in response to sensory stimuli. These issues can affect daily activities, social interactions, and learning environments, making it crucial to manage sensory input and provide appropriate sensory accommodations.",How do sensory issues affect individuals with autism?,"Sensory issues can impact daily life by causing discomfort, anxiety, or sensory overload in response to specific sensory stimuli. These issues can affect behavior, communication, and the ability to participate in activities or environments that are sensory-rich.",How do sensory problems impact autism?,https://www.spectrumnews.org/opinion/sensory-issues-autism-explained/
"Meltdowns are intense responses to overwhelming situations, characterized by emotional outbursts, crying, or aggression. They can be managed through preemptive strategies like sensory breaks, calming techniques, and creating predictable environments that reduce stressors and support emotional regulation.",What are meltdowns and how can they be managed?,"Meltdowns are intense reactions triggered by overwhelming emotions or sensory overload. Managing meltdowns involves creating a calm environment, using calming techniques, and addressing the underlying triggers while ensuring safety and providing support.",What are autism meltdowns?,https://www.autism.org.uk/advice-and-guidance/topics/behaviour/meltdowns
"Executive functioning skills include planning, organization, problem-solving, and impulse control. Autism can affect these skills, making it challenging to initiate tasks, switch focus, or manage time effectively. Individuals with autism may benefit from structured routines, visual supports, and explicit instruction to develop these skills.",What are executive functioning skills and how are they affected by autism?,"Executive functioning skills include abilities such as planning, organization, decision-making, and self-regulation. Individuals with autism may struggle with these skills, which can impact daily tasks, time management, and goal-directed behavior.",How does autism impact executive skills?,https://www.autismspeaks.org/executive-function-skills-autism
"Autism can impact learning and education by affecting communication, social interaction, and sensory processing. Educational strategies often involve individualized approaches, visual aids, and sensory accommodations to support learning strengths and address challenges in academic and social settings.",How does autism affect learning and education?,"Autism can affect learning by influencing how individuals process information, interact with peers and teachers, and engage in classroom activities. Specialized educational strategies and supports are often needed to accommodate learning differences and promote academic success.",How does autism affect learning?,https://www.autism.org.uk/advice-and-guidance/topics/education/education-overview
Autism may affect language development by delaying speech or limiting verbal communication. Some individuals with autism have echolalia (repeating words or phrases) or difficulty with pragmatic language (using language appropriately in social contexts). Speech therapy and augmentative communication strategies can help develop language skills.,How does autism affect language development?,"Autism may affect language development by delaying speech onset, impairing the ability to understand and use language effectively, or leading to atypical language patterns such as echolalia (repeating words or phrases). Speech therapy and alternative communication methods can help improve communication skills.",How does autism impact language?,https://www.autism.org.uk/advice-and-guidance/topics/communication/language
"Autism can affect motor skills, resulting in challenges with coordination, fine motor tasks (like writing), or gross motor movements (like running or catching a ball). Occupational therapy and motor skills training can support the development of motor coordination and independence in daily activities.",How does autism affect motor skills?,"Autism can impact motor skills, including fine motor skills (such as handwriting or manipulating small objects) and gross motor skills (such as coordination and balance). Occupational therapy may address these challenges and improve motor coordination and abilities.",How does autism impact motor skills?,https://www.autismspeaks.org/motor-skills-autism
"Autism can impact emotional regulation by causing difficulties in identifying and expressing emotions, coping with change, or managing frustration. Emotional regulation strategies such as mindfulness, social stories, and sensory supports help individuals with autism understand and manage their feelings effectively.",How does autism affect emotional regulation?,"Emotional regulation can be challenging for individuals with autism, leading to difficulties in identifying and expressing emotions, managing stress or anxiety, and understanding the emotions of others. Techniques such as mindfulness and sensory-based strategies can aid in emotional regulation.",How does autism impact emotions?,https://www.autism.org.uk/about/behaviour/emotional-regulation
"Autism severity levels (mild, moderate, severe) are based on the amount of support an individual requires across different domains (social communication, repetitive behaviors, sensory issues). These levels guide intervention and support strategies tailored to the individual's specific needs and functional abilities.",What are the different levels of autism severity?,"Autism severity is often categorized into three levels based on the level of support needed: Level 1 (requiring support), Level 2 (requiring substantial support), and Level 3 (requiring very substantial support). These levels reflect the degree of impairment in social communication, behavior, and adaptive functioning.",What are autism severity levels?,https://www.autism.org.uk/about/what-is/asperger
"Autism prevalence has increased, with estimates suggesting around 1 in 44 children are diagnosed with autism spectrum disorder. It occurs more frequently in boys than girls and is diagnosed across all racial, ethnic, and socioeconomic groups.",How common is autism?,Autism affects about 1 in 54 children in the United States according to the latest CDC prevalence estimates. The prevalence may vary across populations and geographic regions.,How many people have autism?,https://www.autismspeaks.org/autism-statistics
"Common co-occurring conditions with autism include intellectual disabilities, epilepsy, ADHD (Attention Deficit Hyperactivity Disorder), anxiety disorders, gastrointestinal issues, and sensory processing disorders. Addressing these conditions often requires a multidisciplinary approach to treatment and support.",What are some common co-occurring conditions with autism?,"Common co-occurring conditions with autism include ADHD (Attention-Deficit/Hyperactivity Disorder), anxiety disorders, epilepsy, gastrointestinal issues, sensory processing disorders, and sleep disturbances.",What other conditions come with autism?,https://www.cdc.gov/ncbddd/autism/facts.html
"Autism can affect sleep patterns, leading to difficulties falling asleep, staying asleep, or experiencing restful sleep. Factors such as sensory sensitivities, anxiety, and irregular routines contribute to sleep disturbances. Establishing bedtime routines and creating a sleep-friendly environment can help improve sleep quality for individuals with autism.",How does autism affect sleep patterns?,"Autism can disrupt sleep patterns, leading to difficulties falling asleep, staying asleep, or experiencing restful sleep. Sleep disturbances may affect daytime behavior, mood, and overall well-being.",How does autism impact sleep?,https://www.autism.org.uk/about/health/sleep
"Autism may affect eating habits due to sensory sensitivities, limited food preferences, or rituals around mealtimes. Some individuals with autism have aversions to certain textures or tastes, impacting their nutritional intake. Addressing these challenges involves sensory strategies and gradual exposure to new foods.",How does autism affect eating habits?,"Autism can affect eating habits through selective eating preferences, sensory sensitivities to certain textures or tastes, rigid eating routines, or difficulty with food transitions. Addressing these challenges may involve dietary adjustments and behavioral supports.",How does autism impact eating?,https://www.ncbi.nlm.nih.gov/pmc/articles/PMC5465822/
"Genetics play a significant role in autism, as evidenced by higher concordance rates among identical twins and the identification of specific genetic mutations associated with autism spectrum disorder. However, not all cases of autism can be explained by genetic factors alone, suggesting a complex interplay of genetic and environmental influences.",What role does genetics play in autism?,"Genetics plays a significant role in autism, with evidence suggesting that certain genetic mutations and variations contribute to autism susceptibility. However, autism is complex, and genetic factors interact with environmental influences.",What is the genetic link to autism?,https://www.autismspeaks.org/what-autism/learn-more-autism/what-causes-autism
"Prenatal factors such as maternal infections, exposure to certain medications, or complications during pregnancy can influence the risk of autism. Research suggests that prenatal environment, including maternal health and prenatal care, may contribute to developmental differences associated with autism spectrum disorder.",How does prenatal environment affect the risk of autism?,"Prenatal factors such as maternal infections, exposure to toxins, maternal health conditions (e.g., gestational diabetes), and medications may influence the risk of autism. Research continues to explore the impact of prenatal factors on autism development.",How do prenatal factors impact autism risk?,https://www.spectrumnews.org/news/prenatal-environment-autism-risk/
"Myths about autism include misconceptions about its causes (like vaccines), stereotypes about behaviors (such as all individuals with autism being non-verbal or having savant abilities), and misunderstandings about treatment effectiveness. Educating the public about autism helps dispel myths and promotes acceptance and support for individuals with autism.",What are some myths about autism that need to be debunked?,"Myths about autism include misconceptions about its causes (e.g., vaccines), stereotypes about behaviors and abilities, and outdated beliefs about autism being solely a childhood disorder. Understanding and dispelling myths promote accurate awareness and acceptance of autism.",What myths about autism are false?,https://www.autism-society.org/myths-facts/
"Famous individuals with autism include Temple Grandin, an advocate and animal scientist, and Anthony Hopkins, a renowned actor. Their achievements demonstrate that autism does not preclude success or contribution to society, challenging stereotypes and highlighting diverse talents within the autism community.",What are some famous people with autism?,"Many notable individuals across various fields, including science, technology, arts, and advocacy, have been identified as being on the autism spectrum. Their achievements highlight the diversity of strengths and talents within the autism community.",Who are some famous autistic people?,https://www.autismspeaks.org/famous-people-autism
"Early detection of autism involves monitoring developmental milestones, screening tools like the M-CHAT (Modified Checklist for Autism in Toddlers), and parental observations of behavior and communication. Early intervention can begin as soon as developmental concerns are identified, maximizing outcomes for children with autism.",How can autism be detected early?,"Early detection involves monitoring developmental milestones, conducting screenings, and recognizing early signs of atypical development. Early intervention services can begin as soon as concerns arise about a child’s development.",How is autism spotted early?,https://www.cdc.gov/ncbddd/autism/screening.html
"Screening tools for autism include the M-CHAT, ADOS-2 (Autism Diagnostic Observation Schedule), and CARS (Childhood Autism Rating Scale). These tools assess behaviors associated with autism spectrum disorder and help identify children who may require further evaluation by specialists.",What are some screening tools used for autism?,"Screening tools such as the M-CHAT (Modified Checklist for Autism in Toddlers), ADOS (Autism Diagnostic Observation Schedule), and other standardized assessments are used to evaluate social communication, behavior, and developmental milestones in children suspected of having autism.",What tools diagnose autism?,https://www.autismspeaks.org/diagnosis
"Early intervention for children with autism improves developmental outcomes by targeting specific skills (communication, social interaction, behavior) during critical periods of brain development. Benefits include improved adaptive skills, better academic performance, and enhanced independence in daily activities and social settings.",What are the benefits of early intervention for children with autism?,"Early intervention services, including therapies (e.g., ABA, speech therapy), developmental supports, and educational strategies, can help improve developmental outcomes, social skills, communication abilities, and independence for children with autism.",How does early help benefit autistic kids?,https://www.autismspeaks.org/early-intervention
"Effective therapies for autism include Applied Behavior Analysis (ABA), speech therapy, occupational therapy",What are some effective therapies for autism?,"Effective therapies include Applied Behavior Analysis (ABA) therapy, speech therapy, occupational therapy, social skills training, sensory integration therapy, and cognitive-behavioral therapy. These therapies are tailored to address specific challenges and promote skill development.",What therapies work for autism?,https://www.autismspeaks.org/what-are-treatments-autism
"ABA therapy uses behavior principles to improve social, communication, and learning skills.",What is Applied Behavior Analysis (ABA) therapy?,"ABA therapy is a structured, evidence-based intervention that focuses on improving socially significant behaviors, reducing challenging behaviors, and teaching new skills through positive reinforcement and systematic teaching methods.",What is ABA therapy?,https://www.autismspeaks.org/applied-behavior-analysis-aba-0
Speech therapy helps improve communication skills and language development.,What is speech therapy and how does it help individuals with autism?,"Speech therapy helps individuals with autism improve communication skills, including speech production, language comprehension, expressive language, social communication, and pragmatic language skills.",How does speech therapy help autism?,https://www.autismspeaks.org/speech-therapy-autism
Occupational therapy enhances daily living skills and sensory processing.,What is occupational therapy and how does it benefit individuals with autism?,"Occupational therapy addresses fine motor skills, sensory processing, self-care skills (e.g., dressing, feeding), and daily living activities to promote independence and participation in daily routines for individuals with autism.",How does OT help autism?,https://www.autismspeaks.org/occupational-therapy-autism
Social skills training teaches interaction and communication skills essential for social integration.,What is social skills training and why is it important for individuals with autism?,"Social skills training teaches essential social skills such as initiating conversations, interpreting nonverbal cues, maintaining eye contact, and understanding social norms. These skills are crucial for improving social interactions and relationships.",Why is social skills training important in autism?,https://www.autism-society.org/what-is/social-skills-training/
Sensory integration therapy helps manage sensory sensitivities and improves sensory processing.,What is sensory integration therapy and how does it help individuals with autism?,Sensory integration therapy uses structured activities to help individuals with autism process and respond to sensory stimuli more effectively. It aims to reduce sensory sensitivities and enhance participation in daily activities.,How does sensory therapy help autism?,https://www.autismspeaks.org/sensory-integration-therapy
"Alternative therapies can provide sensory enrichment and emotional support, benefiting engagement and relaxation.",How effective are alternative therapies like music therapy or animal-assisted therapy for autism?,"Alternative therapies such as music therapy, art therapy, and animal-assisted therapy can complement traditional interventions by promoting relaxation, sensory regulation, self-expression, and social engagement in individuals with autism.",Do music and animal therapies help autism?,https://www.autismspeaks.org/alternative-therapies
"Parents can support by creating structured routines, using visual aids, and providing consistent, positive reinforcement.",How can parents support a child with autism at home?,"Parents can support their child with autism by establishing routines, using visual supports, promoting communication, providing sensory-friendly environments, and participating in therapies and educational activities tailored to their child's needs.",How do parents help autistic children at home?,https://www.autismspeaks.org/family-support-tool-kit
"Educators can support by using individualized education plans (IEPs), visual supports, and sensory accommodations.",How can educators support students with autism in the classroom?,"Educators can support students with autism by implementing individualized education plans (IEPs), using visual supports, providing sensory accommodations, promoting peer interactions, and fostering a supportive learning environment that respects individual differences.",How do teachers help autistic students?,https://www.autismspeaks.org/educational-tool-kit
