Context,Questions,Answers,Patterns,Articles
"Strategies include using visual schedules, providing warnings before transitions, and offering transition supports like social stories or countdown timers.",What are some strategies for managing transitions for individuals with autism?,"Strategies include using visual schedules, providing advance notice of changes, offering transition objects or routines, using positive reinforcement, and creating a predictable environment to reduce anxiety and support smooth transitions for individuals with autism.",How do you manage transitions for autism?,https://www.autism.org.uk/advice-and-guidance
"Siblings can be supported through education about autism, encouragement of open communication, and ensuring they have their own outlets for support and attention.",How can siblings of children with autism be supported?,"Siblings can be supported through education about autism, promoting understanding and empathy, providing opportunities for bonding and shared activities, and offering emotional support and resources for coping with the unique challenges and rewards of having a sibling with autism.",How do you support siblings of autistic kids?,https://www.autismspeaks.org/family-dynamics-and-siblings-autism
"Educational rights include access to free and appropriate public education (FAPE), Individualized Education Programs (IEPs), and accommodations under the Individuals with Disabilities Education Act (IDEA).",What are the educational rights of students with autism?,"Students with autism are entitled to educational services and accommodations under federal laws such as the Individuals with Disabilities Education Act (IDEA), which mandates appropriate educational supports and services to meet their individual needs.",What are autistic students' education rights?,https://www.autismspeaks.org/educational-rights-individuals-autism
"Autism can affect family dynamics by requiring additional caregiving responsibilities, impacting financial resources, and influencing family routines and social interactions.",How does autism impact family dynamics?,"Autism may impact family dynamics by requiring adjustments in parenting approaches, time management, financial resources, and social activities. Family members may experience stress but also opportunities for growth, understanding, and advocacy for their loved one with autism.",How does autism affect family life?,https://www.autismspeaks.org/family-life-autism
"Communities can become more inclusive by promoting autism awareness, providing sensory-friendly environments, offering inclusive activities, and fostering acceptance and understanding.",How can communities become more inclusive for individuals with autism?,"Communities can promote inclusion by raising awareness, providing sensory-friendly environments in public spaces, offering inclusive recreational programs and events, and supporting local autism organizations and initiatives that foster acceptance and support for individuals with autism.",How do communities include autistic people?,https://www.autism-society.org/living-with-autism/autism-in-the-community/
"Autism may impact employment opportunities due to challenges in communication, social interaction, and sensory sensitivities, requiring tailored support and accommodations.",How does autism affect employment opportunities for adults?,"Adults with autism may face challenges in finding and maintaining employment due to social communication difficulties, sensory sensitivities, and navigating workplace expectations. However, many individuals with autism possess valuable skills that can contribute to diverse workplaces.",How does autism impact jobs for adults?,https://www.autismspeaks.org/employment-and-autism
"Challenges include difficulties with workplace communication, sensory sensitivities, managing change, and understanding social dynamics, which can affect job performance and integration.",What are some challenges faced by adults with autism in the workplace?,"Challenges include understanding social dynamics, advocating for accommodations, managing sensory sensitivities, accessing career development opportunities, and navigating workplace culture and expectations that may be challenging for individuals with autism.",What work challenges do autistic adults face?,https://www.spectrumnews.org/news/work-challenges-faced-autistic-adults/
"Accommodations include providing clear instructions, creating structured routines, offering sensory-friendly workspaces, and implementing communication supports like visual aids.",What are some accommodations that can be made in the workplace for individuals with autism?,"Accommodations include flexible work schedules, designated quiet spaces, visual supports (e.g., instructions, checklists), clear communication strategies, sensory accommodations, and training for colleagues and supervisors to promote understanding and support.",How do you accommodate autism at work?,https://www.autismspeaks.org/workplace-accommodations
"Autism can affect friendships by making social cues and reciprocity challenging, leading to difficulties in initiating and maintaining relationships.",How does autism affect friendships and social relationships?,"Autism can impact friendships and social relationships by making it challenging to interpret social cues, establish connections, and maintain reciprocal interactions. However, with support and understanding, individuals with autism can develop meaningful relationships.",How does autism impact friendships?,https://www.spectrumnews.org/features/deep-dive/autism-and-friendship/
Autism may impact romantic relationships by affecting social and communication skills necessary for building and sustaining intimate connections.,How does autism affect romantic relationships?,"Autism may affect romantic relationships by influencing communication styles, social interactions, and understanding of emotional cues and intimacy. Supportive relationships, clear communication, and mutual understanding are important factors in fostering successful romantic relationships for individuals with autism.",How does autism impact romance?,https://www.autismspeaks.org/love-sex-and-autism
"Technology can assist by providing communication aids (like speech-generating devices), social skills apps, sensory tools (noise-canceling headphones), and virtual support networks.",How can technology assist individuals with autism?,"Technology can assist individuals with autism by providing communication aids (e.g., AAC devices), social skills apps, sensory regulation tools, virtual supports for remote learning, and assistive technologies that support independence and participation in daily activities.",How does tech help autism?,https://www.autismspeaks.org/assistive-technology-autism